{
  "$schema": "http://json-schema.org/draft-07/schema#",
  "title": "Resource",
  "type": "object",
  "required": [
    "classification",
    "data_tags",
    "name",
    "owner_principal_id",
    "resource_id",
    "resource_type",
    "risk_level",
    "schema_version",
    "tenant_id",
    "uri"
  ],
  "properties": {
    "classification": {
      "type": "string"
    },
    "data_tags": {
      "type": "array",
      "items": {
        "type": "string"
      }
    },
    "name": {
      "type": "string"
    },
    "owner_principal_id": {
      "type": "string"
    },
    "resource_id": {
      "type": "string"
    },
    "resource_type": {
      "type": "string"
    },
    "risk_level": {
      "type": "string"
    },
    "schema_version": {
      "type": "string"
    },
    "tenant_id": {
      "type": "string"
    },
    "uri": {
      "type": "string"
    }
  }
}
